goodnight57,I have a hard time understanding others feelings and can not read facial expressions to save my life.
goodnight57,I have a hard time understanding others intentions.
goodnight57,I don’t always know when its my turn to start or stop talking.
goodnight57,I seem rude at times and do not mean to be.
goodnight57,I cant have multiple friends at a time.
goodnight57,Nope I will only have one friend and push off all of my social needs on them.
goodnight57,My executive function is dysfunctional so I have to have help with somethings other adults would not, like keeping my house clean and paying bills on time things like that.
goodnight57,I do not touch the color purple and if I have to I have to then wipe or wash my hands.
goodnight57,I don’t tend to like people my own age because they bore me.
goodnight57,I stutter some days worse then others.
goodnight57,I don’t like being touched by anyone at all unless you are some very very special to me.
goodnight57,I have to work from home because I suck so bad socially.
goodnight57,I was selectively mute till the fourth grade.
goodnight57,those are some of the crappy things...
goodnight57,BUT....
goodnight57,Asperger’s can be really cool too!!!!
goodnight57,I have an IQ of 160.
goodnight57,I own my own business.
goodnight57,I am more creative than the average person.
goodnight57,Stick me in a room with a bunch of professors and I’m golden!
goodnight57,I can remember license plates by heart in seconds.
goodnight57,I have learned to read body language very well.
goodnight57,I know every plate number not only to every car I have ever owned but all my family’s and peoples that I know.
goodnight57,This came in handy when my car was once stolen.
goodnight57,I can remember almost any stories and things that I read always on point even ones as I read as a child I could recite now by heart.
goodnight57,I play piano, guitar and bass by ear.
goodnight57,I am eccentric and don’t ever have to worry about what others think simply because I don’t care.
goodnight57,I am extremely loyal and honest.
goodnight57,lying and being not being faithful is something my mind just does not process very well.
goodnight57,I feel so proud of my self at times.
goodnight57,Me the little blond mute girl that all through growing up people treated so fragile, Me that girl that her family planned on me never moving away from home having a family of my own and an education.
goodnight57,Well I am that girl and guess what?
goodnight57,I am a grown 25 year old educated woman with two beautiful intelligent children my own business, living on my own with my own little family.
goodnight57,I have a car and pay my own bills.
goodnight57,But not only did I prove everyone wrong I have went beyond that.
goodnight57,I am more put together than most mothers my age at all.
goodnight57,I do need help with somethings still and I do get it when it is needed but the way I see it is everything needs help with something and hey I drive my own car and provide for my own family and beyond.
goodnight57,I am succeeding and I will keep moving forward.
goodnight57,
goodnight62,
goodnight62,    Your halos getting heavy.
goodnight62,You can paint your lead balloon white still it will not stop sinking.
goodnight62,Onto the graves you dug that caused no grief.
goodnight62,A stubborn wave.
goodnight62,A heartless grin over sized and under played so well.
goodnight62,You have surly caught my eye.
goodnight62,Ringing satisfaction like a diamond on a band.
goodnight62,ignorance for the price of forever.
goodnight62,Don’t stop to care.
goodnight62,Stop to think and smirk to your dead.
goodnight62,There is no burden that you carry.
goodnight62,The guiltless of the guilty.
goodnight62,
goodnight73,
goodnight73,     Smack, Brown bug did it.
goodnight73,Laugh, how cute.
goodnight73,Blushing....,
goodnight73,thoughts, really I didn’t do it, brown did it.
goodnight73,summertime lemonade shared
goodnight73,shoe box homes made with love.
goodnight73,Ages takes hold,
goodnight73,Adults hiding a secret one questions enough not to tell
goodnight73,still not enough to admit what may not be true
goodnight73,he is real he is real I know it I can hear him still
goodnight73,quiet but there
goodnight73,invisible but there
goodnight73,seen by the little blond girl
goodnight73,seen by the dark haired woman.
goodnight73,Brown Bug, I still love you and I still believe.
goodnight73, 
goodnight73,
goodnight54,
goodnight54,I like to write.
goodnight54,I like the way my hands move.
goodnight54,Its like playing  the piano.
goodnight54,Half the things I write make no sense at all but I just keep typing.
goodnight54,Open my mind just let what ever wants to come out.
goodnight54,It dosnt have to have to do with me or whats going on in my life.
goodnight54,I just write.
goodnight54, 
goodnight54,
goodnight60,
goodnight60,    Here is a list of things I like about my self
goodnight60,
goodnight60,I am creative
goodnight60,I am a good friend
goodnight60,I am a great artist
goodnight60,I am smart
goodnight60,I am an excellent care giver
goodnight60,my short stories are wonderful
goodnight60,I am pretty
goodnight60,I am a good pianist
goodnight60,I have a cute voice
goodnight60,I am eccentric
goodnight60,I am giving and sweet
goodnight60,I have a big heart full of love and warmth
goodnight60,I never try to hurt anyone
goodnight60,
goodnight60,
goodnight66,
goodnight66,    The truth is I am okay.
goodnight66,I may not feel like it most of the time as of lately but I am okay.
goodnight66,I have been through hell and back and Here I am I am still here.
goodnight66,I may be damaged but I will heal.
goodnight66,I am okay.
goodnight66,I have water, a house, heat, and lights.
goodnight66,I have a car to drive.
goodnight66,I have my art and my music.
goodnight66,Most of all I have my two beautiful perfect children and I have my mother who loves me deeply.
goodnight66,I am okay.
goodnight66,.
goodnight66,Perhaps I have screwed up more  than once but we all have and I am only human.
goodnight66,I have to look at the facts rationally.
goodnight66,I am a great mother.
goodnight66,I am a good honest person.
goodnight66,This is my life and I do not need to throw pearl before swine hoping the swine will turn to gold.
goodnight66,I have no need to dwell over what I can not change.
goodnight66,I can change my self, I can control my self.
goodnight66,I can make good healthy choices for my family and I. I can try my best and when I make a mistake I can pick my self up and brush my self off and learn for the next time.
goodnight66,I am strong and I am worth a lot more then I allow my self to have.
goodnight66,It is time for me to be brave and start giving my self what I deserve.
goodnight66,I do not deserve abuse or to be put down and called names.
goodnight66,I do not deserve to be screamed at or hit.
goodnight66,I do not deserve to be walked all over and used.
goodnight66,I do deserve the be treated kindly and loved.
goodnight66,I am worth having nice things.
goodnight66,I do deserve happiness and comfort.
goodnight66,I am okay and I am worth a lot.
goodnight66,
goodnight50,
goodnight50,     I often hear people saying they have no filter and will say whatever they want because there not fake.
goodnight50,Its not being “fake” its called being a mature adult with morals and values... Not sure how you people were raised but where I come from if you don’t have anything nice to say then don’t say anything at all.
goodnight50,Sure if you need to stand up for your self to a bully or something that you believe in that’s one thing.
goodnight50,However if you are just going around being rude and hurting feelings then try and keep that to your self.
goodnight50,Sometimes I make a mistake and say something rude and not even notice and if it is pointed out to me I will apologize no problem.
goodnight50,Accidents happen but there is no good reason to be hurtful and mean on purpose.
goodnight50,And further more even if you were not raised to use curtesy and respect as a grown adult you should be able to use basic human sense and figure it out.
goodnight50,Its not rocket science to be nice to others.
goodnight50,Also the people I always hear saying this never say things with tact.
goodnight50,For example there is a difference between saying privately to some one “Hey I just thought you should know your makeup is not blended very well and it is obvious.” and then there is this out loud in front of others, ” your face doesn’t match your neck!”  see what I mean you can say the same thing nicely or you could be very hurtful.
goodnight50,So just because you “don’t have a filter because you are not fake” does not give you a free pass to be an ass!
goodnight50,and that’s my rant for the day, lol off my soap box now.
goodnight50,By the way this entry is not about anyone in particular its just something I hear a lot that really annoys me.
goodnight50,
goodnight75,
goodnight75,    I hate when I question what our troops are fighting for and they say our “freedom”.
goodnight75,People seem to get safety and freedom mixed up.
goodnight75,Yes in America we a safer from many things other countries are not, except pollution, obesity, unhealthy food and poverty of course.
goodnight75,However America is not free.
goodnight75,I am not an asshole I am just simply looking at the cold hard facts.
goodnight75,America I number one in three things, obesity, incarceration and laws.
goodnight75,Yes you heard me correctly America “the land of the free’ has more laws then any other country.
goodnight75,on the list of freest countries in the world America does not even make in the list of top ten in fact we are way down at number 20!!!
goodnight75,I am not saying you can not be grateful to live here or have to be “anti-American” but at least look at and admit the truth.
goodnight75,America is not a free country or the land of the free.
goodnight75,America is one of the most heavily patrolled countries in the would proving quit the opposite of freedom.
goodnight75,Stop blindly believing what ever you are told do some fair honest studying on both sides of the fence and also look around you using common sense and your own mind.
goodnight75,Sure we may feel safe here and no one is getting burned at the steak for being gay “thank God!” but we are not as free as you think you know as you are taught.
goodnight75,Sometimes in order to gain freedom one must give up safety.
goodnight75,I would make the payment of possible safety for true freedom and others would not.
goodnight75,either choice is okay equally okay.
goodnight75,All I am asking is lets just be honest about it.
goodnight75,
goodnight49,
goodnight49,Seraphric affection,
goodnight49,Rogue Sovereign,
goodnight49,For who I have marked time loyally before your coming.
goodnight49,Upon arrival of you particular lure.
goodnight49,Madcapped benevolence swept though this vessel.
goodnight49,Electric regards  for my knight fell apace.
goodnight49,Oh how all Gods in heaven shall never dissever our hearts that bind beyond time and space.
goodnight49, 
goodnight49, 
goodnight49, 
goodnight49,
goodnight59,
goodnight59,      I have two young kids, I love them deeply and like most other mothers want the to grow up intelligent, wise and destined for great things.
goodnight59,I also know that creativity and imagination is the cornerstone for this.
goodnight59,Without creativity the world would not and will not progress.
goodnight59,Sadly most adults have lost all imagination.
goodnight59,I am talking about having the ability to wonder, to think outside of your world and what is happing right now.
goodnight59,The ability to not only retain information of what is taught to you by others but to create your own thoughts and ideas.
goodnight59,Schools teach our kids the alphabet and how to counts to 100.
goodnight59,They teach how to identify colors and shapes.
goodnight59,These are all things they will learn in life rather we try to teach them these things or not.
goodnight59,Schools also teach, glue the white cotton balls on the sheep, color inside of the lines, water is blue and fish live inside of the water and birds fly in the sky.
goodnight59,I WILL NOT TEACH MY KIDS TO COLOR INSIDE THE LINES!!!!!
goodnight59,Teaching a child to color inside of the lines takes away there creativity.
goodnight59,Creativity is curtail to the human race and our life as we know it.
goodnight59,To take away ones creativity is to take away there intelligence.
goodnight59,As a whole we are raising our children to become artificial life forms not unique intelligent individuals to progress the forward movement of the earth.
goodnight59,I WILL TEACH MY CHILDREN there art is beautiful inside and outside of the lines.
goodnight59,I will teach my children that it is okay to imagine water can be purple fish can fly and birds life under the sea.
goodnight59,As adults we should try live this way as well.
goodnight59,To think and create for our selves.
goodnight59,What if I wake up tomorrow and a magical fairy with pink butterfly wings spits fire into my soul and I then become a mermaid?
goodnight59,Sound silly?
goodnight59,well its not.
goodnight59,It is important and intelligent to think like this.
goodnight59,Come on people are we forgetting the world is full of infinite possibilities.
goodnight59,Answering questions right or wrong is not the most important thing.
goodnight59,Asking questions is the most important thing.   
goodnight59,
goodnight77,
goodnight77,   As our fight went down to the river still we never prayed.
goodnight77,Now its come down to this fist to face I wont let you win.
goodnight77,He wont let me win.
goodnight77,Baby you have broke my heart and ate me whole.
goodnight77,now where do we go from here when we both don’t go.
goodnight77,down in the river where we never pray.
goodnight77,I love with all my might.
goodnight77,That will never charge.
goodnight77,You try and say I am the one that’s real however now I know this is only a gas light.
goodnight77,I love you so much I will hurt you and hurt my self.
goodnight77,If we both cant win I will not give the submission only runs to the point of dream and now I have seen where the is no light.
goodnight77,that is not a dream but stupid little thing bigger than the both of us.
goodnight77,Now I cant think to speak how long you waited for this day.
goodnight77,I bet you think that thing will go your way.
goodnight77,You are always wrong.
goodnight77,You tried to run away I held you down with my own arms this your force broke me again and the I ran away where you found tied to the tub pulling me away.
goodnight77,It was only a joke when you cried out in pain.
goodnight77,selfish deeds and using me will only bread more shit.
goodnight77,How can you not see how your always wrong.
goodnight77,I wont let you go even when you run Ill be a punching bag before you can leave the scene.
goodnight77,Don’t you lie and say you wont love me.
goodnight77,Don’t you be a fool again to say your leaving me only to return again.
goodnight77,Don’t you think I have learned by now these are only words and you are to go I’m right behind you as you pretend your running for me you only just fast enough for me to trip on your shoe.
goodnight77,no you will never go.
goodnight77,if I drown you drown too.
goodnight77,so what if I am dark so what if I am crazy.
goodnight77,ill eat you whole you will live inside of me.
goodnight77,I got my fork and iv got my knife ready to jump inside my self after you.
goodnight77,you chase me away to grasp my hair and drag me back.
goodnight77,I push you out until you agree to go and then board up your walls you are never leaving me again.
goodnight77,
goodnight69,
goodnight69,  My cement high-rise, Inside I swelter,
goodnight69,tick, tick, a slaves time is to slow for a tock
goodnight69,Looking out this bay of plexi down on to the armored ants honking and beeping
goodnight69,with no time for a tock there is certainly no time to spare for the numbskull in front who ignores changing lights with heavy eyes.
goodnight69,Quick, slick, loafers swift drift alarm the daydreamer back to drudge
goodnight69,Tap, Tap, Tap an endless see of taps and the a space.
goodnight69,tap, tap, space, enter.
goodnight69,Jazz Jiving servitude,
goodnight69,until just one final..
goodnight69,TICK!
goodnight69,A slight smirk of jubilance
goodnight69,Back to MY own armored ant and then MY hut in which where I collect MY keep
goodnight69,ZZZZZZZZZ.......
goodnight69,BUZZZZZ
goodnight69,Armored ant, cement high-rise, porthole, drudge, Jazz Jive, TICK, armored ant, zzzzzzz, buzz
goodnight69,Perplexed
goodnight69, 
goodnight69,
goodnight53,
goodnight53,      Winters death is near.
goodnight53,Its a beautiful and gloomy day.
goodnight53,Its about to rain I can smell it, one of my favorite scents.
goodnight53,So this morning I have opened all the windows of my home.
goodnight53,As I feel the fresh wind  blowing through the house and the seasons changing I can feel my life changing as  well.
goodnight53,In the last month I have lost 22 lbs then for the last few days I have messed up.
goodnight53,I am going to think of the last few days as just a simple break from my life style and get back on it today.
goodnight53,We all need a break sometimes right?
goodnight53,
goodnight61,
goodnight61,    So I run an in-home daycare.
goodnight61,I actually went to school to be a preschool teacher but then found out I make much better money running a daycare from my home especially because then I don’t have to pay for my kids daycare this way while I am working.
goodnight61,I will never get rich of off an in-home daycare but I am okay with that.
goodnight61,We have more than enough and I am happy.
goodnight61,Its funny with my tattoos and abstract writing and other things about me I don’t think a lot of people would expect me to be one to work with kids.
goodnight61,But I do and I love it.
goodnight61,Honestly I don’t think I would love anything else as much as I do teaching and working with children.
goodnight61,Teaching preschoolers has always been my what I wanted to do when I grew up.
goodnight61,I am lucky to be one of the few people that can say I am what I wanted to be when I grew up.
goodnight61,I am good at what I do so its pretty easy to get customers for me.
goodnight61,I put together unique lesson plans.
goodnight61,We do not watch tv at all which is a great selling point for child care.
goodnight61,Every day we do art, music, reading and math or science.
goodnight61,I provide much healthier food then most daycares and I truly love being able to have just enough kids to be able to do group projects and games but also spend one on one time with each one.
goodnight61,To a point I also get to set my own hours and I love that lol who wouldn’t?!
goodnight61,SO ....
goodnight61,Todsay I have TWO new kids coming!!!!!!!
goodnight61,I am so excited!
goodnight61,I am wearing my favorite red long flowered dress to make a good impression and have plans to take them to the park across the street if it is nice enough. 
goodnight61,
goodnight52,
goodnight52,    words mean something and so did I. I didn’t go there and then I did.
goodnight52,I get it , I get what means.
goodnight52,Knowledge.
goodnight52,woe, Joy, I didn’t know, I didn’t know it was so great.
goodnight52,How did I become again.
goodnight52,Why did it start?
goodnight52,I have honestly the answers only ides, I how no ides.
goodnight52,
goodnight79,
goodnight79,     Mondays can be Dark however never as dark as a Sunday.
goodnight79,Bringing the blood thirsty beast out in the night.
goodnight79,Calling her calling her away from me.
goodnight79,Can it be Cant it really truly be?
goodnight79,How strange how easy parts of us can be so easily rapped and stolen away from us?
goodnight79,Where do these pieces go?
goodnight79,Perhaps in a sepulcher next to our masters bed.
goodnight79,Ah yes the master may choose the keep the dead pieces of they so wish to.
goodnight79,Master what a thoughtful name for such a thief however so fitting.
goodnight79,For if you allow one to take a piece of your inside meaningful or not you still have and there for they have mastered you.
goodnight79,After no one has ever said one must like its master.
goodnight79,Hell the Master doesn’t even have to feed.
goodnight79,Owners are not always so sweet as you may wish.
goodnight79,Sometimes they choose to let there own property die.
goodnight79,To watch it burn from the inside out.
goodnight79,Never a thought never even a question why.
goodnight79,To master a sheep you are a dog to master a dog you are a butcher and to master a butcher you are a boss to be worshiped by the strong and to eat the weak.
goodnight79,Desire holds it close and fear keeps it closer, that is if you are smart.
goodnight79,A dog will take his pray by force.
goodnight79,like all animals a dog is filth.
goodnight79,If you are to be mastered by an animal of such filth as a Dog maybe you should burn.
goodnight79,Maybe your ashes well smell better.
goodnight79,I God is cunning and sly.
goodnight79,A God will get what it wants before you even under stand that you are in the mouth of a monster.
goodnight79,If you can look into the mouth of a monster and still with all your heart beg to sit by his side for worship then you are the butcher.
goodnight79,
goodnight51,
goodnight51,     Smiles gleam so radiant.
goodnight51,A sliver tongue, so charming.
goodnight51,An electric touch sends surges through my body.
goodnight51,What a high!
goodnight51,His embrace of enchanting magic.
goodnight51,For the beast my regard quickly became rather tender.
goodnight51,How peculiarly drawn I was to the beast.
goodnight51,Even knowing that in fact he was indeed a beast.
goodnight51,My thoughts were positive.
goodnight51,I do have a beast and this beast loves and cares for me like no other flesh and blood man ever has.
goodnight51,Enlightened,  I was elated to have the privilege to belong to such a creature.
goodnight51,Who would have ever thought it would be me.
goodnight51,For once in my life I was the lucky one.
goodnight51,I was warned, I was  told by many to run and yet I stayed loyal by his side.
goodnight51,It was no matter to me if others were so blind as to not see my luck.
goodnight51,He was my God and beside him was I his queen and together just like that we would stay.
goodnight51,A beast is a beast I suppose.
goodnight51,I am a wise young gentlewoman.
goodnight51,I understood a beasts comes with beastly issues.
goodnight51,But I have a grand heart and a soft touch.
goodnight51,Love and affection will without doubt dwindle the oxidation.
goodnight51,These were my precise thoughts.
goodnight51,My precise thoughts however happened to be counterfactual.
goodnight51,It was not a sea of love I was falling into.
goodnight51,I took a heart felt leap, then down I went into the beasts inferno.
goodnight51,The quandary of the inferno is once your in there is no departure.
goodnight51,The beasts paradox not even a match for Zeno.
goodnight51,Torrid is the mind once in the inferno.
goodnight51,Trepidation sets in paralysis.
goodnight51,When there is no way to run the next logical step is to please.
goodnight51,Laboring no longer for love, not even for kindness, laboring for a break.
goodnight51,The harder you labor the more you give the beast to bite.
goodnight51,Eventually you give way losing sprit.
goodnight51,All that is left is a pocket sized glint of hope that the beast will see his winning and perhaps even treat you as a prize.
goodnight51,Ah but you see this is wide in error.
goodnight51,The beast does not choose to reward his prize not even with small acts to make you feel human.
goodnight51,The beast does not stop.
goodnight51,Screams only fuel his embers, begging only brings lashings.
goodnight51,“Please let me go, I want to go home now.”
goodnight51,“You are home.” says the beast.
goodnight51, 
goodnight51, 
goodnight51,
goodnight70,
goodnight70,    Way down deep under the ocean in the deeps darkest corner of my mind there is cave full of never ender fire of blue and the emerald.
goodnight70,I found this place of wonder shortly after my death.
goodnight70,When I awoke I could smell something different in the air, something strange and cunning.
goodnight70,My blood felt like poison and I liked it.
goodnight70,What a gift a true and unusual gift to bequeath.
goodnight70,Somethin unholy was in the water which I have passed through and retained.
goodnight70,Could this be am I alive have I finally discovered the unsafe feeling of freedom I have always only visited in theory.
goodnight70,Beyond the fire there is no end, no beginning, no light nor darkness.
goodnight70,There only is what is what I can not begin to put into words.
goodnight70,though I can explain the feeling.
goodnight70,Like violent crashing waves of calmness.
goodnight70,The blinding sight that made my body shiver to coma and rocked me to a storm like no other storm before.
goodnight70,This storm was yellow and bright and retained no light.
goodnight70,Silly isn’t it color with out light.
goodnight70,That’s not even possible and yet it happened I can see it now still with my own three eyes.
goodnight70,Burning me with salt and ice.
goodnight70,A burn I would beg for a burn untold of always to be seen.
goodnight70,They say the eyes are the windows of the soul.
goodnight70,Oh but how wrong one can be.
goodnight70,Eyes are only eyes and nothing more.
goodnight70,You can see the emotion around the skin as they wrinkle in a smile or tear in woe and joy.
goodnight70,You can even see the gleam HALLEUJAH HALLEUJAH!!!
goodnight70,in victory of shocking gain and excitement.
goodnight70,Still these are only emotions.
goodnight70,The soul is beyond emotion, beyond good and evil, light and dark.
goodnight70,There are no old souls or new souls.
